{"adjustment_parity_verified":true,"candidate_provider":"feed.direct.bats.v1","comparison_id":"feed-parity.arca-bats-001","created_at":"2026-09-04T14:00:00Z","parity_disposition":"QUALIFIED_FOR_SUBSTITUTION","parity_schema_version":1,"primary_provider":"feed.sip.nyse-arca.v1","sample_end":"2026-06-30T23:59:59Z","sample_start":"2026-01-01T00:00:00Z","symbol_match_pct":"99.98","timestamp_variance_micros_p99":15000}
